{
    "componentChunkName": "component---src-pages-impressum-js",
    "path": "/impressum/",
    "result": {"data":{"me":{"childMdx":{"id":"f1a7fe7a-6399-5d59-9cf0-f3b5efd9131a","excerpt":"Impressum Legal Disclosure Information in accordance with Section 5 TMG: Contact Information: E-Mail:  cursorbeat-blog@adrian-grimm.net Internet address: blog.cursorbeat.dev Disclaimer Accountability for content The contents of our pages have been created with the utmost care. However, we cannot guarantee the contents' accuracy, completeness or topicality. Accordingâ€¦","frontmatter":{"lastUpdated":"2019-10-01","title":"Impressum","email":"cursorbeat-blog@adrian-grimm.net","url":"https://blog.cursorbeat.dev","slug":"cursorbeat-blog-impressum","subtitle":"Legal Disclosure, Terms and conditions and Disclaimer","date":"2019-10-01T00:00:00-07:00","tags":["legal","impressum","terms","disclaimer"],"type":"page"},"body":"var _excluded = [\"components\"];\nfunction _extends() { _extends = Object.assign ? Object.assign.bind() : function (target) { for (var i = 1; i < arguments.length; i++) { var source = arguments[i]; for (var key in source) { if (Object.prototype.hasOwnProperty.call(source, key)) { target[key] = source[key]; } } } return target; }; return _extends.apply(this, arguments); }\nfunction _objectWithoutProperties(source, excluded) { if (source == null) return {}; var target = _objectWithoutPropertiesLoose(source, excluded); var key, i; if (Object.getOwnPropertySymbols) { var sourceSymbolKeys = Object.getOwnPropertySymbols(source); for (i = 0; i < sourceSymbolKeys.length; i++) { key = sourceSymbolKeys[i]; if (excluded.indexOf(key) >= 0) continue; if (!Object.prototype.propertyIsEnumerable.call(source, key)) continue; target[key] = source[key]; } } return target; }\nfunction _objectWithoutPropertiesLoose(source, excluded) { if (source == null) return {}; var target = {}; var sourceKeys = Object.keys(source); var key, i; for (i = 0; i < sourceKeys.length; i++) { key = sourceKeys[i]; if (excluded.indexOf(key) >= 0) continue; target[key] = source[key]; } return target; }\n/* @jsxRuntime classic */\n/* @jsx mdx */\n\nvar _frontmatter = {\n  \"lastUpdated\": \"2019-10-01\",\n  \"title\": \"Impressum\",\n  \"email\": \"cursorbeat-blog@adrian-grimm.net\",\n  \"url\": \"https://blog.cursorbeat.dev\",\n  \"slug\": \"cursorbeat-blog-impressum\",\n  \"subtitle\": \"Legal Disclosure, Terms and conditions and Disclaimer\",\n  \"date\": \"2019-10-01T00:00:00-07:00\",\n  \"tags\": [\"legal\", \"impressum\", \"terms\", \"disclaimer\"],\n  \"type\": \"page\"\n};\nvar layoutProps = {\n  _frontmatter: _frontmatter\n};\nvar MDXLayout = \"wrapper\";\nreturn function MDXContent(_ref) {\n  var components = _ref.components,\n    props = _objectWithoutProperties(_ref, _excluded);\n  return mdx(MDXLayout, _extends({}, layoutProps, props, {\n    components: components,\n    mdxType: \"MDXLayout\"\n  }), mdx(\"h2\", null, \"Impressum\"), mdx(\"h3\", null, \"Legal Disclosure\"), mdx(\"p\", null, \"Information in accordance with Section 5 TMG:\"), mdx(\"p\", null, mdx(\"strong\", {\n    parentName: \"p\"\n  }, \"Contact Information:\")), mdx(\"p\", null, \"E-Mail: \", mdx(\"a\", {\n    parentName: \"p\",\n    \"href\": \"mailto:cursorbeat-blog@adrian-grimm.net\"\n  }, \"cursorbeat-blog@adrian-grimm.net\"), mdx(\"br\", {\n    parentName: \"p\"\n  }), \"\\n\", \"Internet address: blog.cursorbeat.dev\"), mdx(\"h3\", null, \"Disclaimer\"), mdx(\"h4\", null, \"Accountability for content\"), mdx(\"p\", null, \"The contents of our pages have been created with the utmost care. However, we cannot guarantee the contents' accuracy, completeness or topicality. According to statutory provisions, we are furthermore responsible for our own content on these web pages. In this matter, please note that we are not obliged to monitor the transmitted or saved information of third parties, or investigate circumstances pointing to illegal activity. Our obligations to remove or block the use of information under generally applicable laws remain unaffected by this as per \\xA7\\xA7 8 to 10 of the Telemedia Act (TMG).\"), mdx(\"h4\", null, \"Accountability for links\"), mdx(\"p\", null, \"Responsibility for the content of external links (to web pages of third parties) lies solely with the operators of the linked pages. No violations were evident to us at the time of linking. Should any legal infringement become known to us, we will remove the respective link immediately.\"), mdx(\"h4\", null, \"Copyright\"), mdx(\"p\", null, \"Our web pages and their contents are subject to German copyright law. Unless expressly permitted by law, every form of utilizing, reproducing or processing works subject to copyright protection on our web pages requires the prior consent of the respective owner of the rights. Individual reproductions of a work are only allowed for private use. The materials from these pages are copyrighted and any unauthorized use may violate copyright laws. \"), mdx(\"h3\", null, \"Website Terms and Conditions of Use\"), mdx(\"h4\", null, \"1. Terms\"), mdx(\"p\", null, \"By accessing this Website, accessible from \", mdx(\"a\", {\n    parentName: \"p\",\n    \"href\": \"https://blog.cursorbeat.dev\"\n  }, \"https://blog.cursorbeat.dev\"), \", you are agreeing to be bound by these Website Terms and Conditions of Use and agree that you are responsible for the agreement with any applicable local laws. If you disagree with any of these terms, you are prohibited from accessing this site. The materials contained in this Website are protected by copyright and trade mark law. These Terms of Service has been created with the help of the Terms of Service Generator and the Terms & Conditions Example.\"), mdx(\"h4\", null, \"2. Use License\"), mdx(\"p\", null, \"Permission is granted to temporarily download one copy of the materials on Cursorbeat.dev's Website for personal, non-commercial transitory viewing only. This is the grant of a license, not a transfer of title, and under this license you may not:\"), mdx(\"p\", null, \"modify or copy the materials;\\nuse the materials for any commercial purpose or for any public display;\\nattempt to reverse engineer any software contained on Cursorbeat.dev's Website;\\nremove any copyright or other proprietary notations from the materials; or\\ntransferring the materials to another person or \\\"mirror\\\" the materials on any other server.\\nThis will let Cursorbeat.dev to terminate upon violations of any of these restrictions. Upon termination, your viewing right will also be terminated and you should destroy any downloaded materials in your possession whether it is printed or electronic format.\"), mdx(\"h4\", null, \"3. Disclaimer\"), mdx(\"p\", null, \"All the materials on Cursorbeat.dev\\u2019s Website are provided \\\"as is\\\". Cursorbeat.dev makes no warranties, may it be expressed or implied, therefore negates all other warranties. Furthermore, Cursorbeat.dev does not make any representations concerning the accuracy or reliability of the use of the materials on its Website or otherwise relating to such materials or any sites linked to this Website.\"), mdx(\"h4\", null, \"4. Limitations\"), mdx(\"p\", null, \"Cursorbeat.dev or its suppliers will not be hold accountable for any damages that will arise with the use or inability to use the materials on Cursorbeat.dev\\u2019s Website, even if Cursorbeat.dev or an authorize representative of this Website has been notified, orally or written, of the possibility of such damage. Some jurisdiction does not allow limitations on implied warranties or limitations of liability for incidental damages, these limitations may not apply to you.\"), mdx(\"h4\", null, \"5. Revisions and Errata\"), mdx(\"p\", null, \"The materials appearing on Cursorbeat.dev\\u2019s Website may include technical, typographical, or photographic errors. Cursorbeat.dev will not promise that any of the materials in this Website are accurate, complete, or current. Cursorbeat.dev may change the materials contained on its Website at any time without notice. Cursorbeat.dev does not make any commitment to update the materials.\"), mdx(\"h4\", null, \"6. Links\"), mdx(\"p\", null, \"Cursorbeat.dev has not reviewed all of the sites linked to its Website and is not responsible for the contents of any such linked site. The presence of any link does not imply endorsement by Cursorbeat.dev of the site. The use of any linked website is at the user\\u2019s own risk.\"), mdx(\"h4\", null, \"7. Site Terms of Use Modifications\"), mdx(\"p\", null, \"Cursorbeat.dev may revise these Terms of Use for its Website at any time without prior notice. By using this Website, you are agreeing to be bound by the current version of these Terms and Conditions of Use.\"), mdx(\"h4\", null, \"8. Governing Law\"), mdx(\"p\", null, \"Any claim related to Cursorbeat.dev's Website shall be governed by the laws of de without regards to its conflict of law provisions.\"));\n}\n;\nMDXContent.isMDXComponent = true;"}},"pageImg":{"publicURL":"/static/b09fbefb77f129efddb334d56948f57e/arrow-right.svg"}},"pageContext":{}},
    "staticQueryHashes": ["1450885957","3271168831"]}